{"artifact_consumption_receipt_hash":{"algorithm":"sha256","value":"cccccccccccccccccccccccccccccccccccccccccccccccccccccccccccccccc"},"artifact_fetch_observation_id":"synthetic_fetch_observation_stage1_001","authorizes_orders":false,"authorizes_positions":false,"code_commit":"0123456789abcdef0123456789abcdef01234567","config_hash":{"algorithm":"sha256","value":"bbbbbbbbbbbbbbbbbbbbbbbbbbbbbbbbbbbbbbbbbbbbbbbbbbbbbbbbbbbbbbbb"},"created_at":"2026-07-30T08:00:00.000000Z","input_envelope_hash":{"algorithm":"sha256","value":"7777777777777777777777777777777777777777777777777777777777777777"},"input_path":"synthetic_validation","not_a_published_release":true,"not_strategy_evidence":true,"random_seed":0,"release_admission_observation_id":"synthetic_admission_observation_stage1_001","release_status_observation_id":"synthetic_status_observation_stage1_001","rule_approval_id":null,"rule_approval_record_hash":null,"rule_approval_scope":null,"rule_bundle_hash":{"algorithm":"sha256","value":"ffffffffffffffffffffffffffffffffffffffffffffffffffffffffffffffff"},"rule_bundle_id":"synthetic_stage1_rule_bundle","rule_bundle_version":"0.1.0-draft","rule_status":"draft","run_id":"synthetic_run_stage1_001","run_mode":"research","runtime_environment_lock_hash":{"algorithm":"sha256","value":"dddddddddddddddddddddddddddddddddddddddddddddddddddddddddddddddd"},"strategy_case_envelope_hash":{"algorithm":"sha256","value":"6666666666666666666666666666666666666666666666666666666666666666"},"strategy_case_input_hash":{"algorithm":"sha256","value":"8888888888888888888888888888888888888888888888888888888888888888"},"strategy_id":"industrial_bottleneck_event","strategy_input_ref":{"dataset_release_id":"synthetic_release_stage1_001","knowledge_cutoff":"2026-07-30T08:00:00.000000Z","manifest_hash":{"algorithm":"sha256","value":"aaaaaaaaaaaaaaaaaaaaaaaaaaaaaaaaaaaaaaaaaaaaaaaaaaaaaaaaaaaaaaaa"},"release_manifest_schema_version":"1.0.0","schema_version":"1.0.0"},"strategy_run_manifest_schema_version":"0.2.0-draft","strategy_version":"0.1.0-draft","synthetic":true,"synthetic_fixture_id":"synthetic_fixture_stage1_001","synthetic_fixture_payload_hash":{"algorithm":"sha256","value":"9999999999999999999999999999999999999999999999999999999999999999"},"synthetic_fixture_version":"0.1.0-draft","validation_only":true}
